{
  "$schema": "https://json-schema.org/draft/2020-12/schema",
  "$id": "https://schemas.example.invalid/hermesstatus/client-v2-config.schema.json",
  "title": "HermesStatus 2.3 Client configuration",
  "type": "object",
  "required": ["version", "server", "device", "collection"],
  "properties": {
    "version": {"const": 1},
    "server": {
      "type": "object",
      "required": ["url", "verify_tls", "connect_timeout_seconds", "read_timeout_seconds"],
      "properties": {
        "url": {
          "type": "string",
          "pattern": "^https://[^/?#@\\\\\\s]+/?$",
          "maxLength": 2048
        },
        "verify_tls": {"const": true, "default": true},
        "ca_file": {
          "type": ["string", "null"],
          "pattern": "^/[^\\u0000]*$",
          "maxLength": 4096
        },
        "connect_timeout_seconds": {"type": "integer", "minimum": 1, "maximum": 60},
        "read_timeout_seconds": {"type": "integer", "minimum": 1, "maximum": 300}
      },
      "additionalProperties": false
    },
    "device": {
      "type": "object",
      "required": ["id", "name", "fqdn", "token_file"],
      "properties": {
        "id": {
          "type": "string",
          "pattern": "^[a-z0-9][a-z0-9._-]{0,62}$"
        },
        "name": {
          "type": ["string", "null"],
          "minLength": 1,
          "maxLength": 128,
          "pattern": "^[^\\u0000-\\u001F\\u007F]+$"
        },
        "fqdn": {
          "type": ["string", "null"],
          "maxLength": 253,
          "pattern": "^(?:[A-Za-z0-9](?:[A-Za-z0-9-]{0,61}[A-Za-z0-9])?\\.)+[A-Za-z0-9](?:[A-Za-z0-9-]{0,61}[A-Za-z0-9])?\\.?$"
        },
        "token_file": {
          "type": "string",
          "pattern": "^/[^\\u0000]*$",
          "maxLength": 4096
        }
      },
      "additionalProperties": false
    },
    "collection": {
      "type": "object",
      "required": ["interval_seconds"],
      "properties": {
        "interval_seconds": {"type": "integer", "minimum": 10, "maximum": 3600}
      },
      "additionalProperties": false
    },
    "hardware": {
      "type": "object",
      "properties": {
        "smart_devices": {
          "type": "array",
          "maxItems": 64,
          "items": {
            "type": "object",
            "required": ["path"],
            "properties": {
              "path": {"type": "string", "minLength": 6, "maxLength": 132, "pattern": "^/dev/[A-Za-z0-9][A-Za-z0-9._+-]{0,126}$"},
              "type": {"type": ["string", "null"], "maxLength": 64, "pattern": "^[A-Za-z0-9][A-Za-z0-9,._+-]{0,63}$"},
              "label": {"type": ["string", "null"], "maxLength": 128, "pattern": "^[^\\u0000-\\u001F\\u007F]+$"}
            },
            "additionalProperties": false
          }
        },
        "primary_smart_device": {"type": ["string", "null"], "minLength": 6, "maxLength": 132, "pattern": "^/dev/[A-Za-z0-9][A-Za-z0-9._+-]{0,126}$"},
        "filesystem_probes": {
          "type": "array",
          "maxItems": 128,
          "items": {
            "type": "object",
            "required": ["mountpoint", "probe_path"],
            "properties": {
              "mountpoint": {"type": "string", "minLength": 1, "maxLength": 4096, "pattern": "^/[^\\u0000-\\u001F\\u007F]*$"},
              "probe_path": {"type": "string", "minLength": 1, "maxLength": 4096, "pattern": "^/[^\\u0000-\\u001F\\u007F]*$"}
            },
            "additionalProperties": false
          }
        }
      },
      "additionalProperties": false
    }
  },
  "additionalProperties": false,
  "$comment": "Loopback HTTP exists only as an explicit pure-validator test profile and is intentionally outside the production JSON schema."
}
